{"CmdCtrLv": 5, "Cmt": "Factory â€“ Barren - Camera Drones", "Diam": 5820.0, "L": [{"D": 6, "Lv": 0, "S": 3},{"D": 4, "Lv": 0, "S": 11},{"D": 1, "Lv": 0, "S": 11},{"D": 11, "Lv": 0, "S": 10},{"D": 13, "Lv": 0, "S": 8},{"D": 5, "Lv": 0, "S": 1},{"D": 3, "Lv": 0, "S": 11},{"D": 2, "Lv": 0, "S": 11},{"D": 7, "Lv": 0, "S": 4},{"D": 8, "Lv": 0, "S": 11},{"D": 10, "Lv": 0, "S": 9},{"D": 12, "Lv": 0, "S": 2}], "P": [{"H": 0, "La": 1.10907, "Lo": 1.53804, "S": 2345, "T": 2474},{"H": 0, "La": 1.13032, "Lo": 1.53929, "S": 2345, "T": 2474},{"H": 0, "La": 1.13015, "Lo": 1.55269, "S": 2345, "T": 2474},{"H": 0, "La": 1.10846, "Lo": 1.55143, "S": 2345, "T": 2474},{"H": 0, "La": 1.09801, "Lo": 1.53222, "S": 2345, "T": 2474},{"H": 0, "La": 1.14092, "Lo": 1.55882, "S": 2345, "T": 2474},{"H": 0, "La": 1.09774, "Lo": 1.55779, "S": 2345, "T": 2474},{"H": 0, "La": 1.12019, "Lo": 1.53191, "S": 2345, "T": 2474},{"H": 0, "La": 1.11867, "Lo": 1.57243, "S": 2345, "T": 2474},{"H": 0, "La": 1.11918, "Lo": 1.55895, "S": 2345, "T": 2474},{"H": 0, "La": 1.11954, "Lo": 1.54545, "S": null, "T": 2552},{"H": 0, "La": 1.14128, "Lo": 1.53273, "S": 2345, "T": 2474},{"H": 0, "La": 1.12045, "Lo": 1.51829, "S": 2345, "T": 2474}], "Pln": 2016, "R": [{"P": [11, 8, 13], "Q": 10, "T": 9830},{"P": [11, 4], "Q": 10, "T": 3697},{"P": [11, 4, 7], "Q": 10, "T": 3697},{"P": [11, 1], "Q": 10, "T": 3697},{"P": [11, 1, 5], "Q": 10, "T": 3697},{"P": [11, 8], "Q": 10, "T": 3697},{"P": [11, 8, 13], "Q": 10, "T": 3697},{"P": [11, 2], "Q": 10, "T": 3697},{"P": [11, 2, 12], "Q": 10, "T": 3697},{"P": [11, 3], "Q": 10, "T": 3697},{"P": [11, 3, 6], "Q": 10, "T": 3697},{"P": [11, 10, 9], "Q": 10, "T": 3697},{"P": [11, 10], "Q": 10, "T": 3697},{"P": [11, 4], "Q": 10, "T": 9830},{"P": [11, 4, 7], "Q": 10, "T": 9830},{"P": [11, 1], "Q": 10, "T": 9830},{"P": [11, 1, 5], "Q": 10, "T": 9830},{"P": [11, 8], "Q": 10, "T": 9830},{"P": [7, 4, 11], "Q": 3, "T": 2345},{"P": [4, 11], "Q": 3, "T": 2345},{"P": [11, 2, 12], "Q": 10, "T": 9830},{"P": [5, 1, 11], "Q": 3, "T": 2345},{"P": [8, 11], "Q": 3, "T": 2345},{"P": [13, 8, 11], "Q": 3, "T": 2345},{"P": [2, 11], "Q": 3, "T": 2345},{"P": [12, 2, 11], "Q": 3, "T": 2345},{"P": [3, 11], "Q": 3, "T": 2345},{"P": [6, 3, 11], "Q": 3, "T": 2345},{"P": [10, 11], "Q": 3, "T": 2345},{"P": [9, 10, 11], "Q": 3, "T": 2345},{"P": [11, 2], "Q": 10, "T": 9830},{"P": [11, 3, 6], "Q": 10, "T": 9830},{"P": [11, 10], "Q": 10, "T": 9830},{"P": [11, 10, 9], "Q": 10, "T": 9830},{"P": [11, 3], "Q": 10, "T": 9830},{"P": [1, 11], "Q": 3, "T": 2345}]}
